{
  "code_hashes": {
    "code/data_download/download_p0.py": "07947fd1dfd138e8223e49767e4d1ba58b83e4a8f310b3233e603f507bcb73e5",
    "code/data_download/p0_sources.json": "828c955ab204bbd0b718172ba1c6cb9f5e686b5513ebb1a3e2c89e0d72f80feb",
    "code/data_processing/build_model_panels.py": "e8b919edfcd31a834b637f3e2c5ac75cb8230ca8151ec3fbe534191895be784b",
    "code/data_processing/build_p0_datasets.py": "336dd7a954ca9e2ef8e520205dc340c769e5b11b66ecfbf7eb1c60364fa29248",
    "code/problem1/run_q1.py": "2b45723dbf51098df67d7111e9ff3eefca53fdb795514318b8924193cc4140ae",
    "code/problem2/run_q2.py": "0d21cb92f22e02a905040cc788b801d2f36eaad17770a039f55410bc78cc2536",
    "code/problem3/run_q3.py": "fb97e91dd875be2674599dd1bf106ae83d7a0d89f49c965c1b70d55cf73d0e8a",
    "code/schemas/frozen_numbers.schema.json": "a531203eca7b04e5e043c23a69615d8c907ed0ba9bf1cbc138a83a941c54542a",
    "code/schemas/reproducibility_manifest.schema.json": "ccf33320477f6e23a7219b629a4984a51accf739dbf190a62381bc609dc810c1",
    "code/schemas/risk_probe_summary.schema.json": "cd3e0f556efc66476635add092af158db561d945337e9e21c29e90b0c4fcfaa1",
    "code/utils/freeze_results.py": "e2f2e4adfd26e6735eaf6d9722e8906992591d38333f5dbe562d7db7a26cae24",
    "code/utils/plot_style.py": "7d12c2fb846e5df012090deb0c3d3c00f83fabf805bdd3ad7be980c44b2769ee",
    "code/utils/verify_freeze.py": "c5cc2dfe644d224f239a15f8e686dfe0e2867070c3f5872916c99b6a286aad4d",
    "requirements.in": "56273dfa7fe37b5fc7fec081ed25fe5b76ecdee8e47fb9be903c92c061e219cc",
    "requirements.lock.txt": "576f8e30f99894c433c251498ae94476d22f798985ed91920b1138348dedfe64"
  },
  "core_result_hashes": {
    "q1_daily_counterfactual.csv": "c753d3b58116539c717fd90a19c9cccb243785f147c7339b3d041fe419895d0b",
    "q1_event_effects.csv": "4ab2eb8f214e87a83f559360f13bc38b412795638d5e18b961f9f6b0854ce2bb",
    "q1_forecast_metrics.csv": "05eb98a3a34985bb7ac1cd13bc81d693aa1e920cf611b7ea651957c45343b5c2",
    "q1_monthly_shocks.csv": "762c4c9cc7c4f5837591ca419cec9b8912ad90fabdeba407e0ea08799679d605",
    "q1_placebo_distribution.csv": "34ccdf1dfc336befbd4a7e42715b9bd35b4e060291922a7e4d1087b1264b0e55",
    "q1_robustness.csv": "096af9ae6385cad855297fef996c4bf7443933206dab8c531372085a864236ac",
    "q1_structural_shocks.csv": "cc62a538ba1e698ed047e51f94777ac77016af448fcba28c8802f4ea264e9bd1",
    "q1_summary.json": "fbb55e83ed1732d56d64b94e4f5274386ed953d2a72a7411f9a1bf9cfaec204d",
    "q1_volatility.csv": "35ca23ec91e7e3f3acdf7d921eaab584dd725cc6b37386940fc893ede5f8f291",
    "q2_ardl_baseline.csv": "24b5f0e5f31301a2765dc7f0ce4e93ebf4ee70874c5e2ab9a68eb362560d706c",
    "q2_asymmetry.csv": "30ff7483a21e8652d123ee4f493ca9c1926d3680444bd3ac9ad97b0c9ea92440",
    "q2_gdp_validation.csv": "a8178711a2ba02e598431f3dd99f293e1c4f7b0acf403887e223977ca7e76efd",
    "q2_irf.csv": "7e7d019d6591406b580a7e1e6e1df1ccc91ce4bfe9361e3a6530de54ba8b87e2",
    "q2_robustness.csv": "8a339c2113708493d253b8fa7c502364f9bd30c0067147bccd3752769eef97f6",
    "q2_summary.csv": "c4f242f06901a296bba3f9a962f272c2eeea169c8f31f79eb6565e0fbbf57804",
    "q2_summary.json": "b40b736280db17941b4ae9e9a10fb61b4941eff263195249e23caaf9c2884061",
    "q3_buffer_interactions.csv": "0c368557d9f8b259196db246f1515c7a16be82f302c8472ad63a98077edeb9c8",
    "q3_country_pass_through.csv": "fe55299e8d9ab3765f753f55e1110a17fbc1ef867868766144b18e90a413f4dd",
    "q3_panel_irf.csv": "36b85e2d1e54386b37194058fb2770131cc12f305f56ddeadad2ca8e040d202f",
    "q3_policy_counterfactual.csv": "b38907ba0304aeb98c770f57ebcddb148eda80957e41707515a0089a5548d4a4",
    "q3_robustness.csv": "34d521fb724a1a85989d104f55d9d84f4d093afe49cd0ac10eec4478c922215a",
    "q3_summary.csv": "b26465934b9e99fe4df17b324ac8ca32cb23591b9f29b6ba54e9e9c46b26e602",
    "q3_summary.json": "198bdb28e0920c48d7c943a481af7324824f458cda9daf09f3bb15d86bcf1d7c"
  },
  "cutoff": "2026-06-30",
  "final_numbers_source_sha256": "93b98826bf6cce989fb98d42f548795143a2a7c4da041c9b540e569e141e1daf",
  "git_commit": "4cf660e5509e38fdba5e96fd1b3b8415a5f47242",
  "manifest_hash": "6dbb2243e7dcd3c3b8381dbfe44f2c32ef293d76b8020bc876510319b5b05c94",
  "overall_status": "CONDITIONAL",
  "packaging_environment": {
    "packages": {
      "jsonschema": "4.25.1",
      "linearmodels": "6.1",
      "matplotlib": "3.11.1",
      "numpy": "2.4.6",
      "openpyxl": "3.1.5",
      "pandas": "2.3.3",
      "requests": "2.34.2",
      "scipy": "1.17.1",
      "statsmodels": "0.14.6",
      "xlrd": "2.0.2"
    },
    "platform": "Windows-10-10.0.26200-SP0",
    "python_executable": "D:\\L_File\\Py311\\python.exe",
    "python_version": "3.11.9",
    "requirements_lock_sha256": "576f8e30f99894c433c251498ae94476d22f798985ed91920b1138348dedfe64"
  },
  "paper_finalize_allowed": false,
  "processed_input_hashes": {
    "china_fuel_policy_monthly.csv": "c6c84b71c2124d8c15a738c5e395e9e759c195f92297ca2b361fa0a8c361c05c",
    "china_fuel_proxy_monthly.csv": "83fb6263a36deab9e3ab9aa8711f6c9345d823ab5d88698c9302acef8b46563a",
    "cn_fuel_policy_events.csv": "1a8c1e5b04466d8a85d167bb878f3cf7fb2cd9346ef1f083c30cfb3979b81ed6",
    "country_policy_buffers_annual.csv": "c3510f46beda3dbd01b935c8033512a9506310e180deaf4dcda284837bc9d0e7",
    "eu_eurosuper95_monthly.csv": "5e559add8af119a5cd3ec78bf21196023d50ac84537ad1f939ed57199e532495",
    "france_eurosuper95_monthly.csv": "9115f252ff6637f2dd6a4f30b25065ac4324b4749ca20e5c31144b5df2153f06",
    "germany_eurosuper95_monthly.csv": "56259eb38b347a5b81030b5d4c21e6422a496a986da820c226040b1b9354cf54",
    "italy_eurosuper95_monthly.csv": "921ab36a11ad09194bb546f23eb469dba20a7ba47f25446b977008dcc6da81f0",
    "japan_regular_gasoline_monthly.csv": "6253766a9f0873ad0d800695a92b7413560946c51940c588420bdee36e774965",
    "korea_regular_gasoline_monthly.csv": "6de414df2b8e0d7834845cae6777aeba700d5496596d6fbf1156e97a6cbbc406",
    "model_country_monthly.csv": "41f5806ae092516f840293c49f8ea688c695cc60c747901d5c7f2d38d729fe91",
    "model_daily_q1.csv": "aa33448a63fbedcbb5342d4ddcf81f3263e1107a69429d08fdda14b04d8c8981",
    "model_monthly_cn.csv": "53dafde9b46b268fed8681ef12367f6f7e179b04cbbba2605cb6fa6779fb7a2b",
    "model_monthly_q1.csv": "858eab2188af510c5f50cd308796c0b8da603a3aeeaf394b1ba568645e2697af",
    "model_quarterly_cn.csv": "49e689da55af7a9363a7e18e6b824441f4ff135733060de7044643d5b5de4fce",
    "oecd_g20_cpi_monthly.csv": "efe24cc118d64338a552a7bee91f45d8d55d9d4b6e26c3538a447605fdb6c052",
    "oecd_kei_ip_monthly.csv": "d04dbf8b7f7deef01950cfb109fb878d96afb513a896e42d95be0217f05966e2",
    "p0_daily_market.csv": "53150c86307df2b3d96f1b62909cd5180b7fd6656ee8be5982b5f4364c141644",
    "p0_monthly_market.csv": "fb2a07027d77bf0713a0cf2136ee29772ce3fe94b4b76ebeb20445182b57c996",
    "spain_eurosuper95_monthly.csv": "1dbc86c54b8ff45eab29ea0c2ce52e52fd35411676141cef26a952e092592f2b"
  },
  "random_seed": 20260730,
  "replay_environment": {
    "packages": {
      "jsonschema": "4.25.1",
      "linearmodels": "6.1",
      "matplotlib": "3.11.1",
      "numpy": "2.4.6",
      "openpyxl": "3.1.5",
      "pandas": "2.3.3",
      "requests": "2.34.2",
      "scipy": "1.17.1",
      "statsmodels": "0.14.6",
      "xlrd": "2.0.2"
    },
    "python_version": "3.11.9",
    "requirements_lock_sha256": "576f8e30f99894c433c251498ae94476d22f798985ed91920b1138348dedfe64"
  },
  "risk_gate_hash": "33b750e4196a1e94957c17abcbbaf6ef54bddfaab3c76aed9207c059ca3fe0e8",
  "schema_version": "1.0",
  "snapshot_mode": "stage_snapshot_not_paper_final",
  "source_commit": "4cf660e5509e38fdba5e96fd1b3b8415a5f47242",
  "standard_freeze_file": "results/frozen_numbers.json"
}
